{
  "$schema": "../schemas/sprite_schema.json",
  "name": "weapon_fist",
  "atlas": "sprites/weapon_fist_sheet.png",
  "frame_width": 128,
  "frame_height": 128,
  "frames_horizontal": 4,
  "frames_vertical": 1,
  "animations": {
    "idle": {
      "frames": [0],
      "frame_duration": 0.1,
      "looping": true,
      "interruptible": true
    },
    "punch": {
      "frames": [0, 1, 2, 3, 2, 1, 0],
      "per_frame_durations": [0.03, 0.04, 0.05, 0.08, 0.05, 0.04, 0.03],
      "use_per_frame_timing": true,
      "looping": false,
      "interruptible": false,
      "cooldown": 0.2
    }
  },
  "default_animation": "idle"
}
